{
  "schemaVersion": "2.0",
  "paper": {
    "id": "paper.demo",
    "title": "Untitled paper",
    "authors": [],
    "year": null,
    "venue": "",
    "summary": "Replace this demo with the paper's central problem and contribution.",
    "originalUrl": "",
    "pdfUrl": "",
    "localPdfPath": ""
  },
  "evidence": [
    { "id": "evidence.abstract", "label": "Abstract", "kind": "section", "section": "Abstract", "excerpt": "Replace this excerpt with the paper's main claim.", "confidence": "direct" },
    { "id": "evidence.architecture", "label": "Method architecture", "kind": "figure", "section": "Method", "page": 3, "excerpt": "Replace this with the sentence introducing the architecture.", "confidence": "direct" },
    { "id": "evidence.equation", "label": "Main objective", "kind": "equation", "section": "Method", "page": 4, "excerpt": "Replace this with the exact equation and symbol definitions.", "confidence": "direct" },
    { "id": "evidence.algorithm", "label": "Algorithm 1", "kind": "section", "section": "Algorithm 1", "page": 5, "excerpt": "Replace this with the algorithm description.", "confidence": "direct" },
    { "id": "evidence.ablation", "label": "Ablation results", "kind": "table", "section": "Experiments", "page": 7, "excerpt": "Replace this with the values from the ablation table.", "confidence": "direct" },
    { "id": "evidence.figure", "label": "Qualitative result", "kind": "figure", "section": "Results", "page": 8, "excerpt": "Replace this with the qualitative result caption.", "confidence": "direct" }
  ],
  "claims": [
    { "id": "claim.main", "title": "Main claim", "text": "Replace this with the paper's primary grounded claim.", "evidenceIds": ["evidence.abstract"] },
    { "id": "claim.architecture", "title": "Architecture claim", "text": "Replace this with the key data-flow claim.", "evidenceIds": ["evidence.architecture"] },
    { "id": "claim.equation", "title": "Objective claim", "text": "Replace this with what the objective optimizes.", "evidenceIds": ["evidence.equation"] },
    { "id": "claim.algorithm", "title": "Algorithm claim", "text": "Replace this with the state update claim.", "evidenceIds": ["evidence.algorithm"] },
    { "id": "claim.ablation", "title": "Ablation claim", "text": "Replace this with the observed component contribution.", "evidenceIds": ["evidence.ablation"] },
    { "id": "claim.figure", "title": "Qualitative claim", "text": "Replace this with the observation supported by the figure.", "evidenceIds": ["evidence.figure"] }
  ],
  "contributions": [
    { "id": "contribution.main", "title": "Primary contribution", "summary": "Replace this with the main contribution.", "weight": "high", "evidenceIds": ["evidence.abstract"] }
  ],
  "concepts": [
    { "id": "concept.problem", "title": "Problem", "text": "What existing methods cannot do", "evidenceIds": ["evidence.abstract"] },
    { "id": "concept.solution", "title": "Contribution", "text": "What this paper changes", "evidenceIds": ["evidence.abstract"] }
  ],
  "modules": [
    { "id": "module.input", "title": "Input", "summary": "Input representation", "evidenceIds": ["evidence.architecture"] },
    { "id": "module.encoder", "title": "Encoder", "summary": "Builds a contextual representation", "evidenceIds": ["evidence.architecture"] },
    { "id": "module.fusion", "title": "Fusion", "summary": "Combines complementary information", "evidenceIds": ["evidence.architecture"] },
    { "id": "module.decoder", "title": "Decoder", "summary": "Produces the task output", "evidenceIds": ["evidence.architecture"] },
    { "id": "module.output", "title": "Output", "summary": "Final prediction", "evidenceIds": ["evidence.architecture"] }
  ],
  "relations": [
    { "id": "relation.encode", "title": "Encode", "from": "module.input", "to": "module.encoder", "stage": "both", "evidenceIds": ["evidence.architecture"] },
    { "id": "relation.fuse", "title": "Fuse", "from": "module.encoder", "to": "module.fusion", "stage": "both", "evidenceIds": ["evidence.architecture"] },
    { "id": "relation.decode", "title": "Decode", "from": "module.fusion", "to": "module.decoder", "stage": "both", "evidenceIds": ["evidence.architecture"] },
    { "id": "relation.predict", "title": "Predict", "from": "module.decoder", "to": "module.output", "stage": "both", "evidenceIds": ["evidence.architecture"] }
  ],
  "equations": [
    { "id": "equation.objective", "title": "Main objective", "tex": "\\mathcal{L}=\\mathcal{L}_{main}+\\lambda\\mathcal{L}_{reg}", "evidenceIds": ["evidence.equation"] }
  ],
  "algorithms": [
    { "id": "algorithm.main", "title": "Main algorithm", "summary": "Initialize, update, and decode state", "evidenceIds": ["evidence.algorithm"] }
  ],
  "experiments": [
    { "id": "experiment.ablation", "title": "Ablation", "metric": "Demo score", "evidenceIds": ["evidence.ablation"] }
  ],
  "figures": [
    { "id": "figure.qualitative", "title": "Qualitative result", "asset": "assets/demo-figure.svg", "evidenceIds": ["evidence.figure"] }
  ]
}
